{
  "schema_version": "thekingdom.world-commons/0.2",
  "verified": "2026-07-23",
  "canonical_url": "https://thekingdom.dev/commons.json",
  "promise": "A curated doorway to useful world resources. It names access, reuse, automation, and uncertainty separately; it never turns a free doorway into a claim of ownership, safety, truth, or unlimited service.",
  "methodology": {
    "summary": "Resources are selected for broad civic value, credible stewardship, a usable free path, and an official source that explains access or terms.",
    "classification": "Free to access, openly reusable, and safe to automate are different questions. Every card answers all three and keeps provider-specific limits visible.",
    "maintenance": "Each entry carries a checked date. Re-check the linked official terms before material, commercial, high-volume, medical, legal, or emergency use.",
    "boundary": "The Kingdom curates directions, not endorsements. An agent handoff is one reviewed next door, not provider contact, authorization, or permission. Linked providers remain independent; their current terms, licences, privacy practices, coverage, and operational limits govern use."
  },
  "privacy": {
    "human_surface": "Search and filters run only inside the downloaded page. They send no query, create no application profile, and contact a linked provider only when the visitor chooses a link; ordinary hosting still receives the page request.",
    "machine_surface": "The static catalog receives no need or query. A client may match locally. Calling a linked provider crosses into that provider's own privacy, quota, and terms boundary."
  },
  "foundation": {
    "meaning": "A broad first shelf chosen for civilisational usefulness, durable stewardship, legible terms, and a meaningful free path. Foundation is a starting order, not an objective ranking of worth.",
    "criteria": [
      "knowledge or infrastructure many different communities can build from",
      "credible public-interest stewardship and stable identifiers or provenance",
      "a meaningful free path rather than a short promotional trial",
      "download, bulk, API, or offline routes where the resource can responsibly offer them",
      "access, reuse, automation, uncertainty, and safety can be stated separately"
    ],
    "resource_ids": [
      "wikidata",
      "crossref",
      "datacite",
      "software-heritage",
      "openstax",
      "kiwix",
      "project-gutenberg",
      "openstreetmap",
      "natural-earth",
      "gbif",
      "biodiversity-heritage-library",
      "world-bank-indicators",
      "gleif",
      "faostat",
      "who-data",
      "ohchr-uhri",
      "reliefweb",
      "osv",
      "smithsonian-open-access"
    ]
  },
  "categories": [
    {
      "id": "knowledge",
      "label": "Knowledge & evidence",
      "glyph": "⌘",
      "description": "Structured facts, scholarly provenance, and research discovery."
    },
    {
      "id": "learning",
      "label": "Learning",
      "glyph": "◫",
      "description": "Books, courses, and educational foundations that can be reached without tuition."
    },
    {
      "id": "earth",
      "label": "Earth & place",
      "glyph": "◎",
      "description": "Maps, biodiversity, hazards, and the physical context shared by life."
    },
    {
      "id": "public-life",
      "label": "Public life & economy",
      "glyph": "◇",
      "description": "Official statistics, food systems, health context, and small-business registers."
    },
    {
      "id": "rights",
      "label": "Rights & law",
      "glyph": "⚖",
      "description": "Primary legal and rights sources for orientation, never a substitute for counsel."
    },
    {
      "id": "resilience",
      "label": "Resilience",
      "glyph": "△",
      "description": "Humanitarian and hazard information for preparation, with local authorities kept primary."
    },
    {
      "id": "security",
      "label": "Digital safety",
      "glyph": "⬡",
      "description": "Open vulnerability evidence, defensive guidance, and public-interest infrastructure."
    },
    {
      "id": "culture",
      "label": "Culture & memory",
      "glyph": "✦",
      "description": "Public collections and cultural records with item-level rights kept visible."
    }
  ],
  "kits": [
    {
      "id": "verify-a-claim",
      "label": "Trace a claim to evidence",
      "glyph": "⌘",
      "invitation": "Resolve names and identifiers, find the scholarly trail, then read the source rather than inheriting a summary.",
      "keywords": [
        "verify",
        "claim",
        "source",
        "citation",
        "research",
        "doi",
        "paper",
        "evidence"
      ],
      "resource_ids": [
        "wikidata",
        "crossref",
        "datacite",
        "openalex",
        "europe-pmc"
      ],
      "boundary": "Metadata can locate evidence; it cannot establish that a claim is true or that a paper is sound.",
      "steps": [
        "Identify the DOI registration agency, then resolve the entity or DOI through the matching registry.",
        "Compare independent indexes and references.",
        "Open the primary source and retain its identifier, version, and licence."
      ]
    },
    {
      "id": "learn-a-subject",
      "label": "Learn a subject without tuition",
      "glyph": "◫",
      "invitation": "Begin with a structured course or textbook, then widen into literature and research.",
      "keywords": [
        "learn",
        "study",
        "course",
        "textbook",
        "book",
        "school",
        "teach",
        "education"
      ],
      "resource_ids": [
        "openstax",
        "mit-ocw",
        "project-gutenberg",
        "europe-pmc"
      ],
      "boundary": "Free learning materials do not automatically include assessment, accreditation, tutoring, or commercial reuse rights.",
      "steps": [
        "Choose a structured starting text.",
        "Keep the edition and licence with any notes or adaptations.",
        "Use research indexes to update claims that may have changed."
      ]
    },
    {
      "id": "carry-knowledge-offline",
      "label": "Carry knowledge offline",
      "glyph": "◉",
      "invitation": "Prepare a small, local library that can remain useful through weak connectivity, high data costs, censorship, or disruption.",
      "keywords": [
        "offline",
        "library",
        "download",
        "local",
        "resilience",
        "bandwidth",
        "knowledge",
        "archive"
      ],
      "resource_ids": [
        "kiwix",
        "project-gutenberg",
        "natural-earth",
        "openstax"
      ],
      "boundary": "Offline copies can be large, incomplete, or stale. Every source keeps its own licence, and a snapshot never replaces current local emergency, medical, or legal information.",
      "steps": [
        "Choose the language, subject, device, and storage budget.",
        "Check each file's date, size, provenance, and licence before downloading.",
        "Test the library without a network and plan a gentle, explicit update rhythm."
      ]
    },
    {
      "id": "understand-a-place",
      "label": "Understand a place",
      "glyph": "◎",
      "invitation": "Combine geography, public statistics, food systems, and biodiversity without flattening a place into one score.",
      "keywords": [
        "place",
        "country",
        "city",
        "map",
        "population",
        "economy",
        "food",
        "nature"
      ],
      "resource_ids": [
        "openstreetmap",
        "natural-earth",
        "world-bank-indicators",
        "faostat",
        "gbif"
      ],
      "boundary": "Coverage, borders, dates, definitions, and uncertainty differ. A map or indicator is one situated record, not the place itself.",
      "steps": [
        "Start with the geographic scope and vintage.",
        "Read each indicator's definition and source.",
        "Retain attribution and record-level licences when combining data."
      ]
    },
    {
      "id": "prepare-for-disruption",
      "label": "Prepare for disruption",
      "glyph": "△",
      "invitation": "Use global signals to build awareness, then return authority to current local warnings and people on the ground.",
      "keywords": [
        "emergency",
        "earthquake",
        "disaster",
        "hazard",
        "crisis",
        "humanitarian",
        "prepare",
        "resilience"
      ],
      "resource_ids": [
        "usgs-earthquakes",
        "gdacs",
        "reliefweb",
        "who-data",
        "faostat"
      ],
      "boundary": "These sources can be late, incomplete, estimated, or wrong. They must not independently trigger evacuation, medical, or other life-safety decisions.",
      "steps": [
        "Check event time, review status, and source.",
        "Confirm against the relevant local authority.",
        "Use reports for preparation and context, not as live commands."
      ]
    },
    {
      "id": "know-rights-and-law",
      "label": "Find rights and primary law",
      "glyph": "⚖",
      "invitation": "Reach official instruments, recommendations, labour standards, and legislation before seeking jurisdiction-specific help.",
      "keywords": [
        "rights",
        "law",
        "legal",
        "labour",
        "worker",
        "patent",
        "treaty",
        "legislation"
      ],
      "resource_ids": [
        "ohchr-uhri",
        "ilo-normlex",
        "eur-lex-cellar",
        "wipo-lex"
      ],
      "boundary": "A source can orient and evidence; it cannot know the full facts, current local procedure, or give legal advice.",
      "steps": [
        "Identify the jurisdiction, date, and issuing body.",
        "Follow the identifier to the official text.",
        "Check authenticity, amendments, applicability, and professional help where consequences are material."
      ]
    },
    {